{
  "status": "PASS",
  "public_native_unique_constraint_events": 0,
  "b_workload_final_firewall": {
    "streams": 6,
    "verified": true,
    "eof_all": true,
    "closed_all": true,
    "caps_pass": true,
    "errors": 0,
    "postscan_hits": 0,
    "redactions": 18,
    "input_bytes": 18237,
    "output_bytes": 18048
  },
  "source_binding_recomputed": true,
  "privacy_binding_recomputed": true,
  "public_workload": {
    "candidates": {
      "a": {
        "caps_pass": true,
        "closed_all": true,
        "eof_all": true,
        "firewall_errors": 0,
        "firewall_streams": 3,
        "firewall_verified": true,
        "input_bytes": 334672,
        "libraries": {
          "cwork-3m": {
            "build_seconds": 2.128,
            "completed": 42,
            "failed": 0,
            "imported": 42,
            "pending": 0
          },
          "docdb-touqian": {
            "build_seconds": 1.667,
            "completed": 31,
            "failed": 0,
            "imported": 31,
            "pending": 0
          },
          "spbp-2027": {
            "build_seconds": 2.076,
            "completed": 42,
            "failed": 0,
            "imported": 42,
            "pending": 0
          }
        },
        "output_bytes": 334780,
        "post_scan_hits": 0,
        "redactions": 18,
        "searches": 3
      },
      "b": {
        "caps_pass": true,
        "closed_all": true,
        "eof_all": true,
        "firewall_errors": 0,
        "firewall_streams": 6,
        "firewall_verified": true,
        "input_bytes": 18237,
        "libraries": {
          "cwork-3m": {
            "build_seconds": 62.924,
            "completed": 42,
            "completed_before_next_post": 41,
            "failed": 0,
            "imported": 42,
            "max_inflight": 1,
            "pending": 0,
            "post_count": 42
          },
          "docdb-touqian": {
            "build_seconds": 54.406,
            "completed": 31,
            "completed_before_next_post": 30,
            "failed": 0,
            "imported": 31,
            "max_inflight": 1,
            "pending": 0,
            "post_count": 31
          },
          "spbp-2027": {
            "build_seconds": 62.913,
            "completed": 42,
            "completed_before_next_post": 41,
            "failed": 0,
            "imported": 42,
            "max_inflight": 1,
            "pending": 0,
            "post_count": 42
          }
        },
        "native_sql_sanitized_observed": true,
        "output_bytes": 18048,
        "post_scan_hits": 0,
        "redactions": 18,
        "searches": 3,
        "sql_canary_redactions": 18
      }
    },
    "cleanup_failures": 0,
    "counts": {
      "cwork-3m": 42,
      "docdb-touqian": 31,
      "spbp-2027": 42
    },
    "data_class": "PUBLIC_SYNTHETIC_ONLY_NOT_FORMAL_SCORES",
    "document_byte_upper_bound": 524288,
    "finished_at": 1789195771.927572,
    "formal_attempts": 0,
    "formal_queries": 0,
    "migration_id": "89edbd10-2905-41f1-9037-62b502890856",
    "native_sql_errorpath_injected": true,
    "ordinary_document_bytes": 8192,
    "phase": "COMPLETE",
    "private_reads": 0,
    "remaining_runtime": 0,
    "schema": "cwk.rt055.public-workload.v2",
    "source_commit": "6b32584023cd27096e7c2167c0c28f47b380f922",
    "started_at": 1789195513.1469371,
    "status": "PASS",
    "timeout_seconds": 7200,
    "trial_counts": {
      "cwork-3m": 42,
      "docdb-touqian": 31,
      "spbp-2027": 42
    }
  },
  "formal_queries": 0
}
